{"contract_version":"1.0.0","metric_name":"speed","editor_id":"editor-42","video_type":"short-form","duration_seconds":7200,"cohort_video_type":"short-form","cohort_median_seconds":7500,"evidence":{"source":"monday","monday_board_id":"board-1","monday_item_id":"item-1","column_ids":["status","video_type"],"event_ids":["event-100","event-101"],"source_timestamps":["2026-09-01T09:00:00Z","2026-09-01T11:00:00Z"],"source_values":{"start":"In Progress","end":"Ready For Approval","video_type":"short-form"},"rule_version":"speed-v1","calculated_at":"2026-09-01T11:05:00Z"}}
